-98.991,41.276,BOWM/Bowman Lake  State Rec Area  SRA PH:308.745.0230   SITES:12 EL:2060 AMEN:NH ND VT DW NS NR L$ approx 1.3 mi W of Loup City 41.276 -98.991,BOWM,Bowman Lake  State Rec Area,SRA,308.745.0230, , ,12,2060,NH ND VT DW NS NR L$ ,NE,1.3,W,Loup City
-103.088,42.467,BOXB/Box Butte  State Rec Area  SRA PH:308.665.2903   SITES:54 EL:4014 AMEN:E ND VT DW NS NR approx 10.0 mi N  of Hemingford 42.467 -103.088,BOXB,Box Butte  State Rec Area,SRA,308.665.2903, , ,54,4014,E ND VT DW NS NR ,NE,10.0,N ,Hemingford
-96.891,40.973,BRAN/Branched Oak Lake State Rec Area  SRA PH:402.783.3400 all year  SITES:600  AMEN:WES DP SH RS PA approx 5.8 mi W of Raymond 40.973 -96.891,BRAN,Branched Oak Lake State Rec Area,SRA,402.783.3400,all year, ,600, ,WES DP SH RS PA ,NE,5.8,W,Raymond
-103.111,41.679,BRID/Bridgeport  State Rec Area  SRA PH:308.436.2383   SITES:130 EL:3668 AMEN:NH DP NS NR approx 1.1 mi NW of Bridgeport 41.679 -103.111,BRID,Bridgeport  State Rec Area,SRA,308.436.2383, , ,130,3668,NH DP NS NR ,NE,1.1,NW,Bridgeport
-95.645,40.359,BROW/Brownville  State Rec Area  SRA PH:402.825.4551   SITES:130  AMEN:NH ND NS NR L$ approx 2.8 mi S  of Brownville 40.359 -95.645,BROW,Brownville  State Rec Area,SRA,402.825.4551, , ,130, ,NH ND NS NR L$ ,NE,2.8,S ,Brownville
-97.912,42.463,BRUC/Bruce City Park  CP PH:402.358.3557 early apr-late oct  SITES:7 EL:1636 AMEN:WES DP FT DW SH L$ approx 0.4 mi SW of Creighton 42.463 -97.912,BRUC,Bruce City Park,CP,402.358.3557,early apr-late oct, ,7,1636,WES DP FT DW SH L$ ,NE,0.4,SW,Creighton
-97.51,40.352,BRUN/Bruning Dam  CP PH:402.364.2145    EL:1532 AMEN:NH ND PT NS approx 3.2 mi E of Bruning 40.352 -97.51,BRUN,Bruning Dam,CP,402.364.2145, , , ,1532,NH ND PT NS ,NE,3.2,E,Bruning
-97.599,41.107,BUCK/Buckley City Park  CP PH:402.764.2561 all year  SITES:12 EL:1624 AMEN:E DP DW SH N$ approx 0.7 mi SW of Stromsburg 41.107 -97.599,BUCK,Buckley City Park,CP,402.764.2561,all year, ,12,1624,E DP DW SH N$ ,NE,0.7,SW,Stromsburg
-97.309,40.068,BUCK/Buckley Creek  CP    SITES:4  AMEN:E DW approx 1.6 mi NE of Reynolds 40.068 -97.309,BUCK,Buckley Creek,CP, , , ,4, ,E DW ,NE,1.6,NE,Reynolds
-100.794,41.161,BUFF/Buffalo Bill Ranch State Rec Area  SRA PH:308.535.8035  COMM:no shade SITES:29 EL:2812 AMEN:E ND DW NS NR L$ approx 2.3 mi NW of North Platte 41.161 -100.794,BUFF,Buffalo Bill Ranch State Rec Area,SRA,308.535.8035, ,no shade,29,2812,E ND DW NS NR L$ ,NE,2.3,NW,North Platte
-97.497,42.73,BURB/Burbach Park  CP      AMEN:E ND FT DW SH L$ approx 0.1 mi NW of Crofton 42.73 -97.497,BURB,Burbach Park,CP, , , , , ,E ND FT DW SH L$ ,NE,0.1,NW,Crofton
-96.303,40.168,BURC/Burchard Lake State Wildlife Area  SFW PH:402.296.0041 all year  SITES:10  AMEN:NR N$ approx 2.9 mi NE of Burchard 40.168 -96.303,BURC,Burchard Lake State Wildlife Area,SFW,402.296.0041,all year, ,10, ,NR N$ ,NE,2.9,NE,Burchard
-98.938,41.606,BUSS/Bussell City Park  CP PH:308.728.5791   SITES:8 EL:2044 AMEN:WES DP FT DW SH L$ approx 0.5 mi W of Ord 41.606 -98.938,BUSS,Bussell City Park,CP,308.728.5791, , ,8,2044,WES DP FT DW SH L$ ,NE,0.5,W,Ord
-98.841,42.911,BUTT/Butte City Park  CP   COMM:unknown facilities SITES:4  AMEN:E DW L$ approx  mi  of Butte 42.911 -98.841,BUTT,Butte City Park,CP, , ,unknown facilities,4, ,E DW L$ ,NE,,,Butte
-100.16,40.283,CAMB/Cambridge City RV Park  CP     EL:2251 AMEN:E DP DW SH N$ approx 0.3 mi E of Cambridge 40.283 -100.16,CAMB,Cambridge City RV Park,CP, , , , ,2251,E DP DW SH N$ ,NE,0.3,E,Cambridge
-98.646,42.451,CARN/Carney Park  CP    SITES:21 EL:1969 AMEN:WE DP DW SH L$ approx 0.5 mi S  of O'Neill 42.451 -98.646,CARN,Carney Park,CP, , , ,21,1969,WE DP DW SH L$ ,NE,0.5,S ,O'Neill
-101.668,41.204,CEDA/Cedar Vue - Lake McConaughy State Rec Area  SRA PH:308.284.8800 all year  SITES:115 EL:3268 AMEN:WES DP SH RS approx 5.9 mi NE of Ogallala 41.204 -101.668,CEDA,Cedar Vue - Lake McConaughy State Rec Area,SRA,308.284.8800,all year, ,115,3268,WES DP SH RS ,NE,5.9,NE,Ogallala
-103.007,42.708,CHAD/Chadron State Park  SP PH:308.432.6167 all year  SITES:90 EL:3824 AMEN:E DP DW SH RS PA L$ approx 8.4 mi S  of Chadron 42.708 -103.007,CHAD,Chadron State Park,SP,308.432.6167,all year, ,90,3824,E DP DW SH RS PA L$ ,NE,8.4,S ,Chadron
-101.75,40.472,CHAM/Champion Lake State Rec Area  SRA PH:308.394.5118   SITES:8 EL:3251 AMEN:NH ND VT DW NS NR L$ approx 0.2 mi N  of Champion 40.472 -101.75,CHAM,Champion Lake State Rec Area,SRA,308.394.5118, , ,8,3251,NH ND VT DW NS NR L$ ,NE,0.2,N ,Champion
-96.74,40.254,CHAU/Chautauqua Municipal Park - Beatrice  CP PH:402.228.5248   SITES:20  AMEN:WES DP DW SH approx 0.9 mi S  of Beatrice 40.254 -96.74,CHAU,Chautauqua Municipal Park - Beatrice,CP,402.228.5248, , ,20, ,WES DP DW SH ,NE,0.9,S ,Beatrice
-97.62,40.016,CHES/Chester Municipal Park  CP   COMM:run electric cord from pavilion SITES:3  AMEN:E DW SH approx  mi  of Chester 40.016 -97.62,CHES,Chester Municipal Park,CP, , ,run electric cord from pavilion,3, ,E DW SH ,NE,,,Chester
-98.588,40.765,CHEY/Cheyenne  State Rec Area  SRA PH:308.385.6210   SITES:8 EL:1959 AMEN:NH ND DW NS NR L$ approx 17 mi SW of Grand Island 40.765 -98.588,CHEY,Cheyenne  State Rec Area,SRA,308.385.6210, , ,8,1959,NH ND DW NS NR L$ ,NE,17,SW,Grand Island
-97.791,42.352,CHIL/Chilvers Park  CP PH:402.582.4928 all year  SITES:4 EL:1680 AMEN:E FT DW approx 0.1 mi NE of Plainview 42.352 -97.791,CHIL,Chilvers Park,CP,402.582.4928,all year, ,4,1680,E FT DW ,NE,0.1,NE,Plainview
-96.525,41.445,CHRI/Christiansen Field  CP PH:402.727.2810 all year  SITES:150  AMEN:E DP PT DW SH L$ approx 1.6 mi NW of Fremont 41.445 -96.525,CHRI,Christiansen Field,CP,402.727.2810,all year, ,150, ,E DP PT DW SH L$ ,NE,1.6,NW,Fremont
-97.721,40.136,CITY/City RV Park - Deshler  CP    SITES:10 EL:1529 AMEN:WES DP SH approx 0.3 mi S  of Deshler 40.136 -97.721,CITY,City RV Park - Deshler,CP, , , ,10,1529,WES DP SH ,NE,0.3,S ,Deshler
-97.117,41.727,CLAR/Clarkson City Park  CP      AMEN:E DP DW SH L$ approx 0.3 mi E of Clarkson 41.727 -97.117,CLAR,Clarkson City Park,CP, , , , , ,E DP DW SH L$ ,NE,0.3,E,Clarkson
-101.245,42.935,CODY/Cody City Park - Cody  CP     EL:3100 AMEN:E DP DW small L$ approx 0.0 mi S  of Cody 42.935 -101.245,CODY,Cody City Park - Cody,CP, , , , ,3100,E DP DW small L$ ,NE,0.0,S ,Cody
-100.759,41.15,CODP/Cody City Park - North Platte  CP PH:308.535.6706   SITES:40 EL:2799 AMEN:DP approx 0.7 mi N of North Platte 41.15 -100.759,CODP,Cody City Park - North Platte,CP,308.535.6706, , ,40,2799,DP ,NE,0.7,N,North Platte
-97.339,41.431,COLO/Columbus Agricultural Aprk  CP PH:402.564.0133 early oct-late jun  SITES:85  AMEN:WES DP FT DW SH L$ approx 1.1 mi E of Columbus 41.431 -97.339,COLO,Columbus Agricultural Aprk,CP,402.564.0133,early oct-late jun, ,85, ,WES DP FT DW SH L$ ,NE,1.1,E,Columbus
-96.85,40.77,CONE/Conestoga Lake  State Rec Area  SRA PH:402.796.2362   SITES:57  AMEN:E DP VT DW NS NR approx 2.2 mi N  of Denton 40.77 -96.85,CONE,Conestoga Lake  State Rec Area,SRA,402.796.2362, , ,57, ,E DP VT DW NS NR ,NE,2.2,N ,Denton
-96.414,42.412,COTC/Cottonwood Cove Park  CP PH:402.987.3448 early may-late oct  SITES:20  AMEN:WES DP FT DW SH L$ approx 0.3 mi SE of Dakota City 42.412 -96.414,COTC,Cottonwood Cove Park,CP,402.987.3448,early may-late oct, ,20, ,WES DP FT DW SH L$ ,NE,0.3,SE,Dakota City
-101.677,42.916,COTL/Cottonwood Lake  State Rec Area  SRA PH:308.684.3428   SITES:30 EL:3237 AMEN:NH ND VT DW NS NR L$ approx 1.2 mi E of Merriman 42.916 -101.677,COTL,Cottonwood Lake  State Rec Area,SRA,308.684.3428, , ,30,3237,NH ND VT DW NS NR L$ ,NE,1.2,E,Merriman
-98.398,41.397,COTP/Cottonwood Park - Wolbach  CP PH:308.246.5278 early apr-late oct  SITES:5 EL:1841 AMEN:E DW L$ approx 0.2 mi W of Wolbach 41.397 -98.398,COTP,Cottonwood Park - Wolbach,CP,308.246.5278,early apr-late oct, ,5,1841,E DW L$ ,NE,0.2,W,Wolbach
-97.863,42.365,COUN/Country Club - Plainview  CP PH:402.582.3445  COMM:campground next to golf course - unknown facilities  EL:1742 AMEN:E ND NS L$ approx 3.8 mi W of Plainview 42.365 -97.863,COUN,Country Club - Plainview,CP,402.582.3445, ,campground next to golf course - unknown facilities, ,1742,E ND NS L$ ,NE,3.8,W,Plainview
-98.703,41.464,COUC/County Campground - Scotia  CP  all year  SITES:10 EL:1923 AMEN:WE FT DW L$ approx 0.2 mi S  of Scotia 41.464 -98.703,COUC,County Campground - Scotia,CP, ,all year, ,10,1923,WE FT DW L$ ,NE,0.2,S ,Scotia
-103.417,42.687,CRAW/Crawford City Park  CP    SITES:4 EL:3661 AMEN:E DP N$ approx 0.7 mi W of Crawford 42.687 -103.417,CRAW,Crawford City Park,CP, , , ,4,3661,E DP N$ ,NE,0.7,W,Crawford
-98.44,40.456,CRYS/Crystal Lake State Rec Area  SRA PH:308.385.6210   SITES:70 EL:1801 AMEN:E ND VT DW NS NR approx 1.2 mi N of Ayr 40.456 -98.44,CRYS,Crystal Lake State Rec Area,SRA,308.385.6210, , ,70,1801,E ND VT DW NS NR ,NE,1.2,N,Ayr
-97.206,40.13,CRYT/Crystal Springs Lake  CP PH:402.729.2148 early may-mid oct  SITES:60  AMEN:WE DP FT DW SH L$ approx 1.8 mi SW of Fairbury 40.13 -97.206,CRYT,Crystal Springs Lake,CP,402.729.2148,early may-mid oct, ,60, ,WE DP FT DW SH L$ ,NE,1.8,SW,Fairbury
-97.152,40.244,CUBC/Cub Creek Rec Area  CP PH:402.228.3402  COMM:tents only SITES:10  AMEN:NH ND PT DW NS approx 6.9 mi N of Fairbury 40.244 -97.152,CUBC,Cub Creek Rec Area,CP,402.228.3402, ,tents only,10, ,NH ND PT DW NS ,NE,6.9,N,Fairbury
-97.123,41.245,DAVI/David City Park  CP PH:402.367.3135   SITES:12 EL:1611 AMEN:WES DP L$ approx 0.6 mi SE of David City 41.245 -97.123,DAVI,David City Park,CP,402.367.3135, , ,12,1611,WES DP L$ ,NE,0.6,SE,David City
-96.692,41.717,DEAD/Dead Timber State Rec Area  SRA PH:402.664.3597   SITES:42  AMEN:E ND VT DW NS NR approx 3.7 mi N  of Scribner 41.717 -96.692,DEAD,Dead Timber State Rec Area,SRA,402.664.3597, , ,42, ,E ND VT DW NS NR ,NE,3.7,N ,Scribner
-97.721,40.136,DESH/Deshler City Park  CP PH:402.365.4260 all year  SITES:10 EL:1529 AMEN:WES DP FT DW SH N$ approx 0.3 mi S  of Deshler 40.136 -97.721,DESH,Deshler City Park,CP,402.365.4260,all year, ,10,1529,WES DP FT DW SH N$ ,NE,0.3,S ,Deshler
-96.935,40.11,DILL/Diller City Park  CP PH:402.793.5991 all year  SITES:7  AMEN:WES DP FT DW approx 0.2 mi N  of Diller 40.11 -96.935,DILL,Diller City Park,CP,402.793.5991,all year, ,7, ,WES DP FT DW ,NE,0.2,N ,Diller
-98.29,40.582,DLD/DLD State Wayside Rec Area  SRA PH:308.385.6211    EL:1896 AMEN:NH ND NS NR approx 5.3 mi E of Hastings 40.582 -98.29,DLD,DLD State Wayside Rec Area,SRA,308.385.6211, , , ,1896,NH ND NS NR ,NE,5.3,E,Hastings
-101.952,41.269,EAGL/Eagle Canyon - Lake McConaughy State Rec Area  SRA PH:308.287.2673 all year  SITES:30 EL:3279 AMEN:RS approx 15.5 mi NW of Ogallala 41.269 -101.952,EAGL,Eagle Canyon - Lake McConaughy State Rec Area,SRA,308.287.2673,all year, ,30,3279,RS ,NE,15.5,NW,Ogallala
-97.97,40.363,EDGA/Edgar City Camp Facility  CP PH:402.224.5145   SITES:4 EL:1719 AMEN:WES DP FT DW NS approx 0.7 mi S  of Edgar 40.363 -97.97,EDGA,Edgar City Camp Facility,CP,402.224.5145, , ,4,1719,WES DP FT DW NS ,NE,0.7,S ,Edgar
-98.077,41.987,ELGI/Elgin City Park  CP PH:402.843.5822 early may-mid oct COMM:swim SITES:8 EL:1926 AMEN:WES DP FT DW SH L$ approx 0.4 mi NE of Elgin 41.987 -98.077,ELGI,Elgin City Park,CP,402.843.5822,early may-mid oct,swim,8,1926,WES DP FT DW SH L$ ,NE,0.4,NE,Elgin
-101.52,40.431,ENDE/Enders Reservoir State Rec Area  SRA PH:308.394.5118   SITES:232 EL:3149 AMEN:E DP DW SH NR L$ approx 8.8 mi SE of Imperial 40.431 -101.52,ENDE,Enders Reservoir State Rec Area,SRA,308.394.5118, , ,232,3149,E DP DW SH NR L$ ,NE,8.8,SE,Imperial
-96.317,41.016,EUGE/Eugene T. Mahoney State Park  SP PH:402.944.2523 all year  SITES:150  AMEN:WES DP 45ft DW SH RS PA approx 3.1 mi SE of Ashland 41.016 -96.317,EUGE,Eugene T. Mahoney State Park,SP,402.944.2523,all year, ,150, ,WES DP 45ft DW SH RS PA ,NE,3.1,SE,Ashland
-98.34,42.254,EWIN/Ewing City Park  CP PH:402.626.7718   SITES:6 EL:1850 AMEN:E DP L$ approx 0.4 mi SE of Ewing 42.254 -98.34,EWIN,Ewing City Park,CP,402.626.7718, , ,6,1850,E DP L$ ,NE,0.4,SE,Ewing
-96.656,40.139,FEIT/Feits Memorial Park  CP PH:402.645.3539 all year  SITES:15  AMEN:NH DW approx 0.5 mi E of Blue Springs 40.139 -96.656,FEIT,Feits Memorial Park,CP,402.645.3539,all year, ,15, ,NH DW ,NE,0.5,E,Blue Springs
-98.989,40.652,FORK/Fort Kearny  State Rec Area  SRA PH:308.865.5305 all year  SITES:110 EL:2106 AMEN:E DP 45ft DW SH RS PA approx 5.8 mi SE of Kearney 40.652 -98.989,FORK,Fort Kearny  State Rec Area,SRA,308.865.5305,all year, ,110,2106,E DP 45ft DW SH RS PA ,NE,5.8,SE,Kearney
-103.466,42.667,FORT/Fort Robinson State Park  SP PH:308.665.2900 all year  SITES:125 EL:3806 AMEN:WES DP SH RS PA approx 3.2 mi W of Crawford 42.667 -103.466,FORT,Fort Robinson State Park,SP,308.665.2900,all year, ,125,3806,WES DP SH RS PA ,NE,3.2,W,Crawford
-98.038,42.125,FRED/Fred Penn Park  CP PH:402.887.4066 early apr-late oct   EL:1719 AMEN:NH ND PT DW NS approx 0.5 mi SW of Neligh 42.125 -98.038,FRED,Fred Penn Park,CP,402.887.4066,early apr-late oct, , ,1719,NH ND PT DW NS ,NE,0.5,SW,Neligh
-96.559,41.444,FREM/Fremont Lakes  State Rec Area  SRA PH:402.727.3290 all year  SITES:812  AMEN:E DP DW SH RS PA approx 3.2 mi W of Fremont 41.444 -96.559,FREM,Fremont Lakes  State Rec Area,SRA,402.727.3290,all year, ,812, ,E DP DW SH RS PA ,NE,3.2,W,Fremont
-99.979,40.736,GALL/Gallagher Canyon State Rec Area - Cozad  SRA PH:308.785.2685   SITES:25 EL:2674 AMEN:NH ND DW NS NR L$ approx 8.4 mi S  of Cozad 40.736 -99.979,GALL,Gallagher Canyon State Rec Area - Cozad,SRA,308.785.2685, , ,25,2674,NH ND DW NS NR L$ ,NE,8.4,S ,Cozad
-97.737,41.443,GENO/Genoa City Park  CP PH:402.993.2330 all year  SITES:4 EL:1572 AMEN:WES DP FT DW L$ approx 0.5 mi SW of Genoa 41.443 -97.737,GENO,Genoa City Park,CP,402.993.2330,all year, ,4,1572,WES DP FT DW L$ ,NE,0.5,SW,Genoa
-98.369,40.878,GEOR/George Clayton Hall County Park  CP PH:308.385.5087    EL:1864 AMEN:E DP DW SH L$ approx 3.6 mi SW of Grand Island 40.878 -98.369,GEOR,George Clayton Hall County Park,CP,308.385.5087, , , ,1864,E DP DW SH L$ ,NE,3.6,SW,Grand Island
-99.637,40.247,GEOM/George Mitchell RV Park  CP PH:308.824.3511 all year  SITES:10 EL:2057 AMEN:E DP PT DW L$ approx 0.3 mi S  of Oxford 40.247 -99.637,GEOM,George Mitchell RV Park,CP,308.824.3511,all year, ,10,2057,E DP PT DW L$ ,NE,0.3,S ,Oxford
-97.519,42.201,GILM/Gilman Park  CP PH:402.329.4873 early mar-late oct  SITES:4 EL:1572 AMEN:E FT DW SH L$ approx 0.4 mi E of Pierce 42.201 -97.519,GILM,Gilman Park,CP,402.329.4873,early mar-late oct, ,4,1572,E FT DW SH L$ ,NE,0.4,E,Pierce
-97.544,42.502,GLAD/Gladstone City Park  CP PH:402.586.2311 mid apr-late sep COMM:swim SITES:7 EL:1756 AMEN:E DP FT DW L$ approx 0.2 mi NW of Wausa 42.502 -97.544,GLAD,Gladstone City Park,CP,402.586.2311,mid apr-late sep,swim,7,1756,E DP FT DW L$ ,NE,0.2,NW,Wausa
-96.045,41.345,GLEN/Glenn Cunningham Lake  CP PH:402.453.0202     AMEN:E DP approx 6.8 mi N  of Omaha 41.345 -96.045,GLEN,Glenn Cunningham Lake,CP,402.453.0202, , , , ,E DP ,NE,6.8,N ,Omaha
-98.572,42.116,GOOS/Goose Lake State Wildlife Area  SFW PH:402.296.0041  COMM:dispersed  EL:2044 AMEN:NH ND NW NS NR approx 27.4 mi W of Antelope 42.116 -98.572,GOOS,Goose Lake State Wildlife Area,SFW,402.296.0041, ,dispersed, ,2044,NH ND NW NS NR ,NE,27.4,W,Antelope
-103.649,41.235,GOTT/Gotte Park  CP   COMM:unknown facilities  EL:4714 AMEN:NH N$ approx 0.7 mi E of Kimball 41.235 -103.649,GOTT,Gotte Park,CP, , ,unknown facilities, ,4714,NH N$ ,NE,0.7,E,Kimball
-98.538,41.551,GREE/Greeley City park  CP PH:308.428.4010    EL:2011 AMEN:NH ND FT DW NS N$ approx 0.4 mi NW of Greeley Center 41.551 -98.538,GREE,Greeley City park,CP,308.428.4010, , , ,2011,NH ND FT DW NS N$ ,NE,0.4,NW,Greeley Center
-99.215,40.085,GREM/Gremlin Cove - Harlan County Lake  COE PH:308.799.2105   SITES:100 EL:1978 AMEN:NH ND NS NR approx 1.0 mi S  of Republican City 40.085 -99.215,GREM,Gremlin Cove - Harlan County Lake,COE,308.799.2105, , ,100,1978,NH ND NS NR ,NE,1.0,S ,Republican City
-98.116,42.368,GROV/Grove Lake State Wildlife Area  SFW PH:402.296.0041  COMM:dispersed  EL:1733 AMEN:NH ND VT DW NS NR approx 2.5 mi N of Royal 42.368 -98.116,GROV,Grove Lake State Wildlife Area,SFW,402.296.0041, ,dispersed, ,1733,NH ND VT DW NS NR ,NE,2.5,N,Royal
-98.335,40.077,GUID/Guide Rock City Park  CP     EL:1677 AMEN:E DP FT DW L$ approx 0.3 mi NW of Guide Rock 40.077 -98.335,GUID,Guide Rock City Park,CP, , , , ,1677,E DP FT DW L$ ,NE,0.3,NW,Guide Rock
-98.069,40.196,HARB/Harbine Park  CP PH:402.225.4401 all year COMM:swim SITES:5 EL:1683 AMEN:WES DP FT DW L$ approx 0.4 mi S  of Nelson 40.196 -98.069,HARB,Harbine Park,CP,402.225.4401,all year,swim,5,1683,WES DP FT DW L$ ,NE,0.4,S ,Nelson
-95.883,41.135,HAWO/Haworth City Park - Bellevue  CP PH:402.293.3098   SITES:130  AMEN:WE DP approx 3.1 mi SE of Bellevue 41.135 -95.883,HAWO,Haworth City Park - Bellevue,CP,402.293.3098, , ,130, ,WE DP ,NE,3.1,SE,Bellevue
-100.932,40.591,HAYE/Hayes Center State Wildlife Area  SFW   COMM:dispersed  EL:2837 AMEN:NH ND NW NS NR approx 9.3 mi NE of Hayes 40.591 -100.932,HAYE,Hayes Center State Wildlife Area,SFW, , ,dispersed, ,2837,NH ND NW NS NR ,NE,9.3,NE,Hayes
-97.801,41.409,HEAD/Headworks Park - LOUP  UTIL   COMM:ATV area  EL:1581 AMEN:E DW NR N$ approx 4.6 mi SW of Genoa 41.409 -97.801,HEAD,Headworks Park - LOUP,UTIL, , ,ATV area, ,1581,E DW NR N$ ,NE,4.6,SW,Genoa
-100.013,40.307,HOLB/Holbrook City Park  CP PH:308.493.5653 all year  SITES:5 EL:2211 AMEN:E VT DW approx 0.4 mi N  of Holbrook 40.307 -100.013,HOLB,Holbrook City Park,CP,308.493.5653,all year, ,5,2211,E VT DW ,NE,0.4,N ,Holbrook
-99.378,40.436,HOLD/Holdrege City Park  CP PH:308.995.8681    EL:2315 AMEN:E DP FT DW SH approx 0.5 mi SW of Holdrege 40.436 -99.378,HOLD,Holdrege City Park,CP,308.995.8681, , , ,2315,E DP FT DW SH ,NE,0.5,SW,Holdrege
-99.216,41.851,HOME/Homestead Knolls - Calamus State Rec Area  SRA PH:308.346.5666  COMM:some sites reservable SITES:83 EL:2327 AMEN:E DP DW SH RS approx 6.4 mi NW of Burwell 41.851 -99.216,HOME,Homestead Knolls - Calamus State Rec Area,SRA,308.346.5666, ,some sites reservable,83,2327,E DP DW SH RS ,NE,6.4,NW,Burwell
-96.547,41.616,HOOP/Hooper Memorial Park  CP PH:402.654.3649 all year    AMEN:WE FT DW L$ approx 0.4 mi N  of Hooper 41.616 -96.547,HOOP,Hooper Memorial Park,CP,402.654.3649,all year, , , ,WE FT DW L$ ,NE,0.4,N ,Hooper
-97.956,41.107,HORD/Hord Lake  State Rec Area  SRA   COMM:dispersed  EL:1683 AMEN:NH ND NW NS NR approx 2.5 mi E of Central City 41.107 -97.956,HORD,Hord Lake  State Rec Area,SRA, , ,dispersed, ,1683,NH ND NW NS NR ,NE,2.5,E,Central City
-98.882,42.871,HULL/Hull Lake State Wildlife Area  SFW PH:402.296.0041    EL:1825 AMEN:NH ND NS NR approx 3.3 mi SW of Butte 42.871 -98.882,HULL,Hull Lake State Wildlife Area,SFW,402.296.0041, , , ,1825,NH ND NS NR ,NE,3.3,SW,Butte
-95.946,40.159,HUMB/Humboldt Lake Park  CP PH:402.862.2171   SITES:12  AMEN:E DP L$ approx 0.3 mi S  of Humboldt 40.159 -95.946,HUMB,Humboldt Lake Park,CP,402.862.2171, , ,12, ,E DP L$ ,NE,0.3,S ,Humboldt
-97.488,41.686,HUMP/Humphrey City Park  CP  early may-late oct   EL:1675 AMEN:WE DW L$ approx 0.5 mi SW of Humphrey 41.686 -97.488,HUMP,Humphrey City Park,CP, ,early may-late oct, , ,1675,WE DW L$ ,NE,0.5,SW,Humphrey
-99.229,40.083,HUNT/Hunter Cove - Harlan County Lake  COE PH:308.799.2105 early may-late nov  SITES:160 EL:1977 AMEN:E DP DW SH RS PA L$ approx 1.3 mi S  of Republican City 40.083 -99.229,HUNT,Hunter Cove - Harlan County Lake,COE,308.799.2105,early may-late nov, ,160,1977,E DP DW SH RS PA L$ ,NE,1.3,S ,Republican City
-95.569,40.254,INDI/Indian Cave State Park  SP PH:402.883.2575 all year  SITES:274  AMEN:E DP DW SH RS PA approx 2.5 mi N of Barada 40.254 -95.569,INDI,Indian Cave State Park,SP,402.883.2575,all year, ,274, ,E DP DW SH RS PA ,NE,2.5,N,Barada
-96.1,40.047,IRON/Iron Horse Trail Lake  CP   COMM:swim SITES:11  AMEN:E ND PT DW NS  40.047 -96.1,IRON,Iron Horse Trail Lake,CP, , ,swim,11, ,E ND PT DW NS ,NE,,,
-96.481,41.937,ISLA/Island Park City Campground  CP PH:402.687.4188     AMEN:E DP DW SH L$ approx 0.4 mi W of Lyons 41.937 -96.481,ISLA,Island Park City Campground,CP,402.687.4188, , , , ,E DP DW SH L$ ,NE,0.4,W,Lyons
-100.402,40.96,JEFF/Jeffrey Canyon State Wildlife Area  SFW PH:402.296.0041  COMM:dispersed  EL:2749 AMEN:NH ND NW NS NR approx 4.7 mi S  of Brady 40.96 -100.402,JEFF,Jeffrey Canyon State Wildlife Area,SFW,402.296.0041, ,dispersed, ,2749,NH ND NW NS NR ,NE,4.7,S ,Brady
-99.297,41.225,JODS/John D. Sims Memorial Park  CP   COMM:unknown facilities  EL:2251 AMEN:E approx 0.2 mi NE of Mason City 41.225 -99.297,JODS,John D. Sims Memorial Park,CP, , ,unknown facilities, ,2251,E ,NE,0.2,NE,Mason City
-99.83,40.679,JOHN/Johnson Lake  State Rec Area  SRA PH:308.785.2685 all year  SITES:207 EL:2623 AMEN:E DP 40ft DW SH RS PA approx 8.4 mi SW of Lexington 40.679 -99.83,JOHN,Johnson Lake  State Rec Area,SRA,308.785.2685,all year, ,207,2623,E DP 40ft DW SH RS PA ,NE,8.4,SW,Lexington
-96.452,41.435,JOHP/Johnson Park  CP PH:402.727.2630  COMM:unknown facilities  approx 2.4 mi E of Fremont 41.435 -96.452,JOHP,Johnson Park,CP,402.727.2630, ,unknown facilities, , ,,NE,2.4,E,Fremont
-100.603,40.198,KARR/Karrer Park  CP PH:308.345.2022   SITES:14 EL:2481 AMEN:E DP DW SH approx 1.1 mi E of McCook 40.198 -100.603,KARR,Karrer Park,CP,308.345.2022, , ,14,2481,E DP DW SH ,NE,1.1,E,McCook
-99.766,42.669,KELL/Keller Park  State Rec Area  SRA PH:402.684.2921 all year  SITES:35 EL:2188 AMEN:E DP VT DW NS NR L$ approx 9.8 mi NE of Ainsworth 42.669 -99.766,KELL,Keller Park  State Rec Area,SRA,402.684.2921,all year, ,35,2188,E DP VT DW NS NR L$ ,NE,9.8,NE,Ainsworth
-100.166,40.944,LAFA/Lafayette Park  CP PH:308.537.3677   SITES:30 EL:2608 AMEN:E DP DW SH L$ approx 1.2 mi N  of Gothenburg 40.944 -100.166,LAFA,Lafayette Park,CP,308.537.3677, , ,30,2608,E DP DW SH L$ ,NE,1.2,N ,Gothenburg
-100.765,41.047,LAKE/Lake Maloney State Rec Area  SRA PH:308.535.8025 all year  SITES:256 EL:3018 AMEN:E DP DW SH RS approx 6.4 mi S  of North Platte 41.047 -100.765,LAKE,Lake Maloney State Rec Area,SRA,308.535.8025,all year, ,256,3018,E DP DW SH RS ,NE,6.4,S ,North Platte
-103.516,41.943,LAKR/Lake Minatare State Rec Area  SRA PH:308.783.2911   SITES:160 EL:4138 AMEN:E DP SH RS PA approx 9.4 mi NE of Scottsbluff 41.943 -103.516,LAKR,Lake Minatare State Rec Area,SRA,308.783.2911, , ,160,4138,E DP SH RS PA ,NE,9.4,NE,Scottsbluff
-97.353,41.496,LAKN/Lake North - LOUP  UTIL PH:402.564.3171  COMM:swim  EL:1529 AMEN:NH DW NR N$  41.496 -97.353,LAKN,Lake North - LOUP,UTIL,402.564.3171, ,swim, ,1529,NH DW NR N$ ,NE,,,
-101.671,41.22,LAKO/Lake Ogallala - Lake McConaughy State Rec Area  SRA PH:308.284.8800 all year  SITES:262 EL:3281 AMEN:E ND DW SH RS PA approx 6.8 mi N of Ogallala 41.22 -101.671,LAKO,Lake Ogallala - Lake McConaughy State Rec Area,SRA,308.284.8800,all year, ,262,3281,E ND DW SH RS PA ,NE,6.8,N,Ogallala
-101.85,41.238,LAKV/Lakeview - Lake McConaughy  SRA PH:308.284.8800 all year   EL:3278 AMEN:NH ND NS RS approx 10.2 mi NW of Ogallala 41.238 -101.85,LAKV,Lakeview - Lake McConaughy,SRA,308.284.8800,all year, , ,3278,NH ND NS RS ,NE,10.2,NW,Ogallala
-96.605,40.854,LANC/Lancaster Event Center  CP PH:402.441.6545 all year  SITES:300  AMEN:WE DP FT DW SH approx 5.2 mi NE of Lincoln 40.854 -96.605,LANC,Lancaster Event Center,CP,402.441.6545,all year, ,300, ,WE DP FT DW SH ,NE,5.2,NE,Lincoln
-97.088,42.427,LAUR/Laurel City Park  CP PH:402.256.9614 all year  SITES:7  AMEN:WE DP FT DW approx 0.2 mi SE of Laurel 42.427 -97.088,LAUR,Laurel City Park,CP,402.256.9614,all year, ,7, ,WE DP FT DW ,NE,0.2,SE,Laurel
-96.963,40.473,LEGN/Legion Memorial Park - Wilber  CP PH:402.821.3016 all year  SITES:43  AMEN:WE DP FT DW SH L$ approx 0.6 mi S  of Wilber 40.473 -96.963,LEGN,Legion Memorial Park - Wilber,CP,402.821.3016,all year, ,43, ,WE DP FT DW SH L$ ,NE,0.6,S ,Wilber
-96.985,40.259,LEIS/Leisure Lake WMA  SFW PH:402.228.3402  COMM:unknown facilities   AMEN:NH ND NS approx 3.0 mi S  of Plymouth 40.259 -96.985,LEIS,Leisure Lake WMA,SFW,402.228.3402, ,unknown facilities, , ,NH ND NS ,NE,3.0,S ,Plymouth
-101.816,41.271,LEMO/Lemoyne - Lake McConaughy  SRA PH:308.284.8800 all year   EL:3288 AMEN:NH ND NS RS approx 11.1 mi NW of Ogallala 41.271 -101.816,LEMO,Lemoyne - Lake McConaughy,SRA,308.284.8800,all year, , ,3288,NH ND NS RS ,NE,11.1,NW,Ogallala
-97.64,42.838,LEWI/Lewis and Clark  State Rec Area  SRA PH:402.388.4169 all year  SITES:310  AMEN:E ND SH RS PA approx 10.5 mi NW of Crofton 42.838 -97.64,LEWI,Lewis and Clark  State Rec Area,SRA,402.388.4169,all year, ,310, ,E ND SH RS PA ,NE,10.5,NW,Crofton
-99.751,40.786,LEXI/Lexington City Park  CP  all year COMM:in Plum Creek Park ?  EL:2395 AMEN:E FT DW N$ approx 0.6 mi NW of Lexington 40.786 -99.751,LEXI,Lexington City Park,CP, ,all year,in Plum Creek Park ?, ,2395,E FT DW N$ ,NE,0.6,NW,Lexington
-98.302,40.265,LIBE/Liberty Cove Rec Area  CP   COMM:unknown facilities  EL:1866 AMEN:E approx 2.9 mi SW of Lawrence 40.265 -98.302,LIBE,Liberty Cove Rec Area,CP, , ,unknown facilities, ,1866,E ,NE,2.9,SW,Lawrence
-98.083,40.021,LINC/Lincoln Park  CP PH:402.879.4713 early feb-mid nov  SITES:20 EL:1568 AMEN:E DP FT DW L$ approx 0.9 mi W of Superior 40.021 -98.083,LINC,Lincoln Park,CP,402.879.4713,early feb-mid nov, ,20,1568,E DP FT DW L$ ,NE,0.9,W,Superior
-97.095,42.425,LION/Lions Club Park - Laurel  CP   COMM:unknown facilities   AMEN:E approx  mi  of Laurel 42.425 -97.095,LION,Lions Club Park - Laurel,CP, , ,unknown facilities, , ,E ,NE,,,Laurel
-96.988,42.236,LION/Lions Park City - Wayne  CP PH:402.375.3549   SITES:20  AMEN:WE DP NS approx 1.6 mi E of Wayne 42.236 -96.988,LION,Lions Park City - Wayne,CP,402.375.3549, , ,20, ,WE DP NS ,NE,1.6,E,Wayne
-101.684,41.247,LITT/Little Thunder - Lake McConaughy State Rec Area  SRA PH:308.284.8800 all year  SITES:42 EL:3278 AMEN:WES ND DW SH RS approx 8.4 mi N of Ogallala 41.247 -101.684,LITT,Little Thunder - Lake McConaughy State Rec Area,SRA,308.284.8800,all year, ,42,3278,WES ND DW SH RS ,NE,8.4,N,Ogallala
