-90.091,48.003,DEVF/Devilfish Lake - Grand Portage State Forest  SF PH:218.387.3039  COMM:primitive - open all year but snow may block SITES:5 EL:1893 AMEN:NH ND VT DW NS NR L$ approx 20.8 mi NE of Grand Marais 48.003 -90.091,DEVF,Devilfish Lake - Grand Portage State Forest,SF,218.387.3039, ,primitive - open all year but snow may block,5,1893,NH ND VT DW NS NR L$ ,MN,20.8,NE,Grand Marais
-94.849,46.354,DOWE/Dower Lake Rec Area  CP PH:218.894.2553     AMEN:E DP FT DW SH NR approx 2.6 mi W of Staples 46.354 -94.849,DOWE,Dower Lake Rec Area,CP,218.894.2553, , , , ,E DP FT DW SH NR ,MN,2.6,W,Staples
-96.017,48.782,DURG/Durgin Memorial Park  CP PH:218.528.3670     AMEN:WE DP FT DW L$ approx 0.1 mi W of Badger 48.782 -96.017,DURG,Durgin Memorial Park,CP,218.528.3670, , , , ,WE DP FT DW L$ ,MN,0.1,W,Badger
-94.51,43.991,EAGL/Eagle Nest Park  CP PH:507.375.3393 mid may-mid sep  SITES:20  AMEN:E ND FT DW SH L$ approx 5.9 mi E of St. James 43.991 -94.51,EAGL,Eagle Nest Park,CP,507.375.3393,mid may-mid sep, ,20, ,E ND FT DW SH L$ ,MN,5.9,E,St. James
-90.394,48.037,EAST/East Bearskin Lake  NF PH:218.387.1750/218.626.4300 early may-late oct  SITES:33 EL:1739 AMEN:NH ND NS RS PA approx 20.0 mi N  of Grand Marais 48.037 -90.394,EAST,East Bearskin Lake,NF,218.387.1750/218.626.4300,early may-late oct, ,33,1739,NH ND NS RS PA ,MN,20.0,N ,Grand Marais
-94.096,47.525,EASS/East Seelye Bay  NF PH:218.246.2123/218.335.8600   SITES:13  AMEN:NH ND VT DW NS NR approx 19.4 mi NW of Deer River 47.525 -94.096,EASS,East Seelye Bay,NF,218.246.2123/218.335.8600, , ,13, ,NH ND VT DW NS NR ,MN,19.4,NW,Deer River
-92.491,48.17,ECHO/Echo Lake  NF PH:218.666.0020/218.626.4300 mid may-late aug  SITES:24  AMEN:NH ND NS RS approx 34.2 mi NW of Ely 48.17 -92.491,ECHO,Echo Lake,NF,218.666.0020/218.626.4300,mid may-late aug, ,24, ,NH ND NS RS ,MN,34.2,NW,Ely
-91.228,47.373,ERBE/Eckbeck ? Finland State Forest  SF PH:218.226.6365  COMM:primitive - open all year but snow may block SITES:31  AMEN:NH ND VT DW NS NR L$ approx 3.0 mi S  of Finland 47.373 -91.228,ERBE,Eckbeck ? Finland State Forest,SF,218.226.6365, ,primitive - open all year but snow may block,31, ,NH ND VT DW NS NR L$ ,MN,3.0,S ,Finland
-92.504,47.437,EVEL/Eveleth Veterans Memorial Park  CP PH:218.744.7491 mid may-mid sep  SITES:38  AMEN:E DP DW SH RS approx 2.4 mi SE of Eveleth 47.437 -92.504,EVEL,Eveleth Veterans Memorial Park,CP,218.744.7491,mid may-mid sep, ,38, ,E DP DW SH RS ,MN,2.4,SE,Eveleth
-94.666,43.677,EVER/Everett Park  CP PH:507.230.0152 mid apr-late sep  SITES:30  AMEN:E DP DW SH PA approx 3.4 mi NE of Sherburn 43.677 -94.666,EVER,Everett Park,CP,507.230.0152,mid apr-late sep, ,30, ,E DP DW SH PA ,MN,3.4,NE,Sherburn
-91.722,47.952,FALL/Fall Lake  NF PH:218.365.7600/218.626.4300 early may-late sep  SITES:73  AMEN:E ND DW SH RS approx 7.5 mi NE of Ely 47.952 -91.722,FALL,Fall Lake,NF,218.365.7600/218.626.4300,early may-late sep, ,73, ,E ND DW SH RS ,MN,7.5,NE,Ely
-96.046,47.608,FARM/Farmers Union  CP PH:218.687.3408 early jun-late aug  SITES:24  AMEN:E approx 4.5 mi S  of Erskine 47.608 -96.046,FARM,Farmers Union,CP,218.687.3408,early jun-late aug, ,24, ,E ,MN,4.5,S ,Erskine
-93.488,46.145,FATH/Father Hennepin State Park  SP PH:320.676.8763 all year  SITES:100  AMEN:E DP DW SH RS approx 0.9 mi NW of Isle 46.145 -93.488,FATH,Father Hennepin State Park,SP,320.676.8763,all year, ,100, ,E DP DW SH RS ,MN,0.9,NW,Isle
-95.154,48.551,FAUN/Faunce - Beltrami Island SF  SF PH:218.783.6252  COMM:primitive - open all year but snow may block SITES:6  AMEN:NH VT DW NR approx 3.5 mi NW of Forest Area 48.551 -95.154,FAUN,Faunce - Beltrami Island SF,SF,218.783.6252, ,primitive - open all year but snow may block,6, ,NH VT DW NR ,MN,3.5,NW,Forest Area
-91.915,47.996,FENS/Fenske Lake  NF PH:218.365.7600/218.626.4300 early may-late sep  SITES:20  AMEN:NH ND NS RS approx 6.8 mi N  of Ely 47.996 -91.915,FENS,Fenske Lake,NF,218.365.7600/218.626.4300,early may-late sep, ,20, ,NH ND NS RS ,MN,6.8,N ,Ely
-91.241,47.414,FIN3/Finland - Finland State Forest  SF PH:218.226.6365  COMM:primitive - open all year but snow may block SITES:39  AMEN:NH ND VT DW NS NR L$ approx 0.2 mi E of Finland 47.414 -91.241,FIN3,Finland - Finland State Forest,SF,218.226.6365, ,primitive - open all year but snow may block,39, ,NH ND VT DW NS NR L$ ,MN,0.2,E,Finland
-92.171,47.505,FISH/Fishermans Point City Campground  CP PH:218.225.3337   SITES:70  AMEN:E DW SH approx 1.9 mi SW of Hoyt Lakes 47.505 -92.171,FISH,Fishermans Point City Campground,CP,218.225.3337, , ,70, ,E DW SH ,MN,1.9,SW,Hoyt Lakes
-94.46,44.295,FLAN/Flandrau State Park  SP PH:507.233.9800 all year  SITES:90  AMEN:E DP DW SH RS approx 1.4 mi S  of New Ulm 44.295 -94.46,FLAN,Flandrau State Park,SP,507.233.9800,all year, ,90, ,E DP DW SH RS ,MN,1.4,S ,New Ulm
-92.911,46.93,FLOO/Floodwood Municipal  CP PH:218.476.2751 early may-late sep  SITES:9  AMEN:E DP FT DW SH approx 0.4 mi E of Floodwood 46.93 -92.911,FLOO,Floodwood Municipal,CP,218.476.2751,early may-late sep, ,9, ,E DP FT DW SH ,MN,0.4,E,Floodwood
-90.408,48.053,FLOU/Flour Lake  NF PH:218.387.1750/218.626.4300 early may-mid oct  SITES:37 EL:1778 AMEN:NH ND NS RS approx 21.2 mi N  of Grand Marais 48.053 -90.408,FLOU,Flour Lake,NF,218.387.1750/218.626.4300,early may-mid oct, ,37,1778,NH ND NS RS ,MN,21.2,N ,Grand Marais
-92.281,46.66,FOND/Fond du Lac City  CP      AMEN:WES DP FT DW SH approx 12.2 mi SW of Duluth 46.66 -92.281,FOND,Fond du Lac City,CP, , , , , ,WES DP FT DW SH ,MN,12.2,SW,Duluth
-92.212,43.64,FORE/Forestville Mystery Cave State Park  SP PH:507.352.5111 all year  SITES:75  AMEN:E DP 50ft FT DW SH RS approx 6.8 mi W of Preston 43.64 -92.212,FORE,Forestville Mystery Cave State Park,SP,507.352.5111,all year, ,75, ,E DP 50ft FT DW SH RS ,MN,6.8,W,Preston
-94.729,44.452,FORT/Fort Ridgely State Park  SP PH:507.426.7840 all year  SITES:40  AMEN:E DP DW SH RS approx 5.2 mi S  of Fairfax 44.452 -94.729,FORT,Fort Ridgely State Park,SP,507.426.7840,all year, ,40, ,E DP DW SH RS ,MN,5.2,S ,Fairfax
-95.755,47.574,FOST/Fosston City Campground  CP PH:218.435.1959   SITES:10  AMEN:E DP DW SH L$ approx 0.2 mi SW of Fosston 47.574 -95.755,FOST,Fosston City Campground,CP,218.435.1959, , ,10, ,E DP DW SH L$ ,MN,0.2,SW,Fosston
-94.869,46.63,FRAM/Frames Landing Campsite  CP   COMM:unknown facilities   AMEN:NH ND NS approx 0.8 mi SE of Nimrod 46.63 -94.869,FRAM,Frames Landing Campsite,CP, , ,unknown facilities, , ,NH ND NS ,MN,0.8,SE,Nimrod
-94.059,48.642,FRAN/Franz Jevne State Park  SP PH:218.783.6252 all year  SITES:18  AMEN:NH 30ft VT NR approx 2.2 mi NE of Birchdale 48.642 -94.059,FRAN,Franz Jevne State Park,SP,218.783.6252,all year, ,18, ,NH 30ft VT NR ,MN,2.2,NE,Birchdale
-92.346,44.533,FRON/Frontenac State Park  SP PH:651.345.3401 all year  SITES:60  AMEN:E DP DW SH RS approx 1.6 mi N of Frontenac 44.533 -92.346,FRON,Frontenac State Park,SP,651.345.3401,all year, ,60, ,E DP DW SH RS ,MN,1.6,N,Frontenac
-95.493,43.792,FURY/Fury Island Co Park  CP  mid may-mid sep COMM:unknown facilities SITES:23  AMEN:DW SH approx 7.6 mi SE of Fulda 43.792 -95.493,FURY,Fury Island Co Park,CP, ,mid may-mid sep,unknown facilities,23, ,DW SH ,MN,7.6,SE,Fulda
-92.44,46.405,GARF/Garfvert - Nemadji State Forest  SF PH:218.485.5420  COMM:primitive - open all year but snow may block SITES:18  AMEN:NH ND VT DW NS NR L$ approx 2.8 mi E of Nickerson 46.405 -92.44,GARF,Garfvert - Nemadji State Forest,SF,218.485.5420, ,primitive - open all year but snow may block,18, ,NH ND VT DW NS NR L$ ,MN,2.8,E,Nickerson
-95.746,44.263,GARV/Garvin County Park  CP PH:507.629.4081  COMM:two campgrounds SITES:30  AMEN:E DP DW SH approx 3.4 mi N of Garvin 44.263 -95.746,GARV,Garvin County Park,CP,507.629.4081, ,two campgrounds,30, ,E DP DW SH ,MN,3.4,N,Garvin
-91.108,47.505,GEOR/George Crosby - Manitou State Park  SP PH:218.226.6365 all year  SITES:20  AMEN:NH NR approx 16.2 mi NE of Silver Bay 47.505 -91.108,GEOR,George Crosby - Manitou State Park,SP,218.226.6365,all year, ,20, ,NH NR ,MN,16.2,NE,Silver Bay
-96.932,48.77,GILB/Gilbert Olson Park  CP    SITES:36  AMEN:E DP FT DW SH L$ approx 0.7 mi SE of Hallock 48.77 -96.932,GILB,Gilbert Olson Park,CP, , , ,36, ,E DP FT DW SH L$ ,MN,0.7,SE,Hallock
-94.995,44.463,GILF/Gilfillan Estate  CP PH:507.249.3633 mid may-mid sep  SITES:44  AMEN:E DW SH PA approx 4.7 mi NW of Morgan 44.463 -94.995,GILF,Gilfillan Estate,CP,507.249.3633,mid may-mid sep, ,44, ,E DW SH PA ,MN,4.7,NW,Morgan
-95.53,45.541,GLAC/Glacial Lakes State Park  SP PH:320.239.2860 all year  SITES:40  AMEN:E DP DW SH RS approx 5.1 mi S  of Starbuck 45.541 -95.53,GLAC,Glacial Lakes State Park,SP,320.239.2860,all year, ,40, ,E DP DW SH RS ,MN,5.1,S ,Starbuck
-95.678,46.312,GLEN/Glendalough State Park  SP PH:218.864.0110 all year COMM:walk to sites only (carts provided) SITES:22  AMEN:NH FTVT DW SH RS approx 2.8 mi NE of Battle Lake 46.312 -95.678,GLEN,Glendalough State Park,SP,218.864.0110,all year,walk to sites only (carts provided),22, ,NH FTVT DW SH RS ,MN,2.8,NE,Battle Lake
-91.467,47.144,GOOS/Gooseberry Falls State Park  SP PH:218.834.3855 all year  SITES:70  AMEN:NH DP DW SH RS approx 12.7 mi NE of Two Harbors 47.144 -91.467,GOOS,Gooseberry Falls State Park,SP,218.834.3855,all year, ,70, ,NH DP DW SH RS ,MN,12.7,NE,Two Harbors
-90.345,47.746,GRAM/Grand Marais City RV Park  CP PH:218.387.1712   SITES:300  AMEN:WE DP DW SH approx 0.6 mi SW of Grand Marais 47.746 -90.345,GRAM,Grand Marais City RV Park,CP,218.387.1712, , ,300, ,WE DP DW SH ,MN,0.6,SW,Grand Marais
-91.409,43.939,GREA/Great River Bluffs State Park  SP PH:507.643.6849 early jun-late aug  SITES:31  AMEN:NH 45ft FT DW SH RS approx 13.7 mi SE of Winona 43.939 -91.409,GREA,Great River Bluffs State Park,SP,507.643.6849,early jun-late aug, ,31, ,NH 45ft FT DW SH RS ,MN,13.7,SE,Winona
-94.039,46.634,GREE/Greer Lake - Crow Wing State Forest  SF PH:218.546.5926  COMM:primitive - open all year but snow may block SITES:31  AMEN:NH ND VT DW NS NR L$ approx 11.2 mi N  of Crosby 46.634 -94.039,GREE,Greer Lake - Crow Wing State Forest,SF,218.546.5926, ,primitive - open all year but snow may block,31, ,NH ND VT DW NS NR L$ ,MN,11.2,N ,Crosby
-95.623,48.302,GRYG/Grygla Camping Area  CP      AMEN:E DP DW SH approx 0.2 mi W of Grygla 48.302 -95.623,GRYG,Grygla Camping Area,CP, , , , , ,E DP DW SH ,MN,0.2,W,Grygla
-94.834,47.16,GULC/Gulch Lake - Paul Bunyan State Forest  SF PH:218.308.2300  COMM:primitive - open all year but snow may block SITES:8  AMEN:NH ND VT DW NS NR L$ approx 5.3 mi SW of Laporte 47.16 -94.834,GULC,Gulch Lake - Paul Bunyan State Forest,SF,218.308.2300, ,primitive - open all year but snow may block,8, ,NH ND VT DW NS NR L$ ,MN,5.3,SW,Laporte
-94.353,46.411,GULL/Gull Lake Recreation Area  COE PH:218.829.3334 early may-late oct  SITES:40  AMEN:E DP DW SH RS PA approx 8.3 mi NW of Brainerd 46.411 -94.353,GULL,Gull Lake Recreation Area,COE,218.829.3334,early may-late oct, ,40, ,E DP DW SH RS PA ,MN,8.3,NW,Brainerd
-96.601,48.661,HALM/Halma City Park  CP PH:218.436.2738     AMEN:FT PA approx 0.0 mi NW of Halma 48.661 -96.601,HALM,Halma City Park,CP,218.436.2738, , , , ,FT PA ,MN,0.0,NW,Halma
-92.007,43.558,HARM/Harmony City Camping  CP      AMEN:E DW L$ approx 0.2 mi NE of Harmony 43.558 -92.007,HARM,Harmony City Camping,CP, , , , , ,E DW L$ ,MN,0.2,NE,Harmony
-91.125,47.663,HARR/Harriet Lake  NF PH:218.663.7280/218.626.4300   SITES:13 EL:1765 AMEN:NR N$ approx 11.2 mi E of Isabella 47.663 -91.125,HARR,Harriet Lake,NF,218.663.7280/218.626.4300, , ,13,1765,NR N$ ,MN,11.2,E,Isabella
-93.206,46.951,HAYL/Hay Lake  - Savanna State Forest  SF PH:218.426.3271  COMM:primitive - open all year but snow may block SITES:20  AMEN:NH ND VT DW NS NR L$ approx 4.5 mi SE of Jacobson 46.951 -93.206,HAYL,Hay Lake  - Savanna State Forest,SF,218.426.3271, ,primitive - open all year but snow may block,20, ,NH ND VT DW NS NR L$ ,MN,4.5,SE,Jacobson
-95.539,48.634,HAYE/Hayes Lake State Park  SP PH:218.425.7504 all year  SITES:35  AMEN:NH DP DW SH RS approx 17.9 mi SE of Roseau 48.634 -95.539,HAYE,Hayes Lake State Park,SP,218.425.7504,all year, ,35, ,NH DP DW SH RS ,MN,17.9,SE,Roseau
-96.275,47.283,HEIB/Heiberg Park  CP PH:218.584.5254  COMM:primitive - outdoor toilets?   AMEN:NH ND NS approx 1.7 mi NW of Twin Valley 47.283 -96.275,HEIB,Heiberg Park,CP,218.584.5254, ,primitive - outdoor toilets?, , ,NH ND NS ,MN,1.7,NW,Twin Valley
-96.792,47.269,HEND/Hendrum Community Park  CP PH:218.861.6210     AMEN:WES DP FT DW L$ approx 1.0 mi E of Hendrum 47.269 -96.792,HEND,Hendrum Community Park,CP,218.861.6210, , , , ,WES DP FT DW L$ ,MN,1.0,E,Hendrum
-92.193,47.663,HERI/Heritage City Park  CP  mid may-mid sep  SITES:18  AMEN:WE DP FT DW SH approx 0.3 mi NE of Embarrass 47.663 -92.193,HERI,Heritage City Park,CP, ,mid may-mid sep, ,18, ,WE DP FT DW SH ,MN,0.3,NE,Embarrass
-92.24,44.877,HIGH/Highland Ridge - Eau Galle Reservoir  COE PH:715.778.5562     AMEN:E DP SH NR  44.877 -92.24,HIGH,Highland Ridge - Eau Galle Reservoir,COE,715.778.5562, , , , ,E DP SH NR ,MN,,,
-93.591,46.993,HILL/Hill Lake City Park  CP PH:218.697.2301   SITES:30  AMEN:E approx 0.4 mi E of Hill City 46.993 -93.591,HILL,Hill Lake City Park,CP,218.697.2301, , ,30, ,E ,MN,0.4,E,Hill City
-95.529,45.608,HOBO/Hobo Park - Starbuck  CP PH:612.239.2336   SITES:93  AMEN:WE DP DW SH approx 0.5 mi S  of Starbuck 45.608 -95.529,HOBO,Hobo Park - Starbuck,CP,612.239.2336, , ,93, ,WE DP DW SH ,MN,0.5,S ,Starbuck
-92.291,44.471,HOKS/Hok Si La City Park  CP PH:651.345.3855  COMM:tents only   AMEN:NH ND NS approx 1.9 mi NW of Lake City 44.471 -92.291,HOKS,Hok Si La City Park,CP,651.345.3855, ,tents only, , ,NH ND NS ,MN,1.9,NW,Lake City
-96.303,44.265,HOLE/Hole in the Mountain County Park  CP PH:507.368.9350    EL:1792 AMEN:WE DP DW SH approx 0.9 mi W of Lake Benton 44.265 -96.303,HOLE,Hole in the Mountain County Park,CP,507.368.9350, , , ,1792,WE DP DW SH ,MN,0.9,W,Lake Benton
-96.761,48.204,HOLI/Holiday City Park - Warren  CP PH:218.745.5343     AMEN:E DP DW SH approx 0.8 mi NE of Warren 48.204 -96.761,HOLI,Holiday City Park - Warren,CP,218.745.5343, , , , ,E DP DW SH ,MN,0.8,NE,Warren
-96.193,48.292,HOLT/Holt Park  CP PH:218.449.3015  COMM:primitive   AMEN:NH approx 0.0 mi SW of Holt 48.292 -96.193,HOLT,Holt Park,CP,218.449.3015, ,primitive, , ,NH ,MN,0.0,SW,Holt
-92.299,47.819,HOOD/Hoodoo Point City Campground  CP PH:218.753.6868 mid may-mid sep  SITES:85  AMEN:WE DP DW SH approx 1.5 mi NW of Tower 47.819 -92.299,HOOD,Hoodoo Point City Campground,CP,218.753.6868,mid may-mid sep, ,85, ,WE DP DW SH ,MN,1.5,NW,Tower
-96.302,44.263,HORS/Horse Hill Co Park  CP    SITES:30 EL:1782 AMEN:E DW SH approx 0.8 mi W of Lake Benton 44.263 -96.302,HORS,Horse Hill Co Park,CP, , , ,30,1782,E DW SH ,MN,0.8,W,Lake Benton
-96.942,48.777,HORP/Horseshoe Park  CP      AMEN:E DP FT DW SH L$ approx 0.3 mi NE of Hallock 48.777 -96.942,HORP,Horseshoe Park,CP, , , , , ,E DP FT DW SH L$ ,MN,0.3,NE,Hallock
-91.572,43.766,HOUS/Houston Nature Center  CP PH:507.896.4668  COMM:walk to tent sites only SITES:10  AMEN:NH ND DW SH approx 0.2 mi NW of Houston 43.766 -91.572,HOUS,Houston Nature Center,CP,507.896.4668, ,walk to tent sites only,10, ,NH ND DW SH ,MN,0.2,NW,Houston
-95.183,47.06,HUNG/Hungryman Lake- Two Inlets State Forest  SF PH:218.266.2100  COMM:primitive - open all year but snow may block SITES:14  AMEN:NH ND VT DW NS NR L$ approx 11.2 mi NW of Park Rapids 47.06 -95.183,HUNG,Hungryman Lake- Two Inlets State Forest,SF,218.266.2100, ,primitive - open all year but snow may block,14, ,NH ND VT DW NS NR L$ ,MN,11.2,NW,Park Rapids
-94.928,46.739,HUNT/Huntersville Forest Landing - Huntersville State Forest  SF PH:218.472.2100  COMM:primitive - open all year but snow may block SITES:24  AMEN:NH ND VT DW NS NR approx 3.1 mi SW of Huntersville 46.739 -94.928,HUNT,Huntersville Forest Landing - Huntersville State Forest,SF,218.472.2100, ,primitive - open all year but snow may block,24, ,NH ND VT DW NS NR ,MN,3.1,SW,Huntersville
-94.905,46.768,HUNT/Huntersville Township  CP      AMEN:NH ND NS approx 0.8 mi SW of Huntersville 46.768 -94.905,HUNT,Huntersville Township,CP, , , , , ,NH ND NS ,MN,0.8,SW,Huntersville
-91.847,47.273,INDI/Indian Lake - Cloquet Valley State Forest  SF PH:218.226.6377  COMM:primitive - open all year but snow may block SITES:26 EL:1507 AMEN:NH ND VT DW NS NR L$ approx 19.2 mi NW of Two Harbors 47.273 -91.847,INDI,Indian Lake - Cloquet Valley State Forest,SF,218.226.6377, ,primitive - open all year but snow may block,26,1507,NH ND VT DW NS NR L$ ,MN,19.2,NW,Two Harbors
-92.185,46.722,INDI/Indian Point City Campground  CP PH:218.628.4977   SITES:70  AMEN:WE DP 45ft DW SH approx 6.0 mi SW of Duluth 46.722 -92.185,INDI,Indian Point City Campground,CP,218.628.4977, , ,70, ,WE DP 45ft DW SH ,MN,6.0,SW,Duluth
-92.668,45.395,INTM/Interstate State Park  SP PH:651.465.5711 all year  SITES:40  AMEN:E DP 35ft DW SH RS approx 0.9 mi SW of Taylors Falls 45.395 -92.668,INTM,Interstate State Park,SP,651.465.5711,all year, ,40, ,E DP 35ft DW SH RS ,MN,0.9,SW,Taylors Falls
-90.615,48.068,IRON/Iron Lake  NF PH:218.387.1750/218.626.4300 early may-mid oct  SITES:7 EL:1867 AMEN:NH ND NS RS approx 25.5 mi NW of Grand Marais 48.068 -90.615,IRON,Iron Lake,NF,218.387.1750/218.626.4300,early may-mid oct, ,7,1867,NH ND NS RS ,MN,25.5,NW,Grand Marais
-93.192,45.574,ISAN/Isanti County Fairgrounds  CP PH:763.689.2555 all year COMM:primitive   AMEN:WE DP DW SH approx 1.7 mi E of Cambridge 45.574 -93.192,ISAN,Isanti County Fairgrounds,CP,763.689.2555,all year,primitive, , ,WE DP DW SH ,MN,1.7,E,Cambridge
-96.812,48.337,ISLA/Island Park - Argyle  CP    SITES:22  AMEN:E DW approx 0.5 mi NE of Argyle 48.337 -96.812,ISLA,Island Park - Argyle,CP, , , ,22, ,E DW ,MN,0.5,NE,Argyle
-95.119,43.859,ISLW/Island Park - Windom  CP PH:507.831.6129     AMEN:E FT DW NS PA L$ approx 1.0 mi S  of Windom 43.859 -95.119,ISLW,Island Park - Windom,CP,507.831.6129, , , , ,E FT DW NS PA L$ ,MN,1.0,S ,Windom
-94.939,43.944,ISLV/Island View - Mountain Lake  CP PH:507.427.2999 early may-late sep  SITES:10  AMEN:WES DP DW SH PA approx 0.6 mi NW of Mountain Lake 43.944 -94.939,ISLV,Island View - Mountain Lake,CP,507.427.2999,early may-late sep, ,10, ,WES DP DW SH PA ,MN,0.6,NW,Mountain Lake
-93.523,47.248,ITAS/Itasca County Fairgrounds  CP PH:218.326.6470     AMEN:E DP DW SH approx 0.9 mi NE of Grand Rapids 47.248 -93.523,ITAS,Itasca County Fairgrounds,CP,218.326.6470, , , , ,E DP DW SH ,MN,0.9,NE,Grand Rapids
-95.197,47.234,ITAS/Itasca State Park  SP PH:218.266.2100 all year  SITES:225  AMEN:E DP SH RS approx 22.5 mi N  of Park Rapids 47.234 -95.197,ITAS,Itasca State Park,SP,218.266.2100,all year, ,225, ,E DP SH RS ,MN,22.5,N ,Park Rapids
-93.274,47.009,JACO/Jacobson County Campground  CP PH:218.927.7364   SITES:10  AMEN:NH ND VT DW NS L$ approx 0.6 mi NW of Jacobson 47.009 -93.274,JACO,Jacobson County Campground,CP,218.927.7364, , ,10, ,NH ND VT DW NS L$ ,MN,0.6,NW,Jacobson
-92.367,46.655,JAYC/Jay Cooke State Park  SP PH:218.384.4610 all year  SITES:80  AMEN:E DP 60ft VT DW SH RS approx 2.8 mi E of Carlton 46.655 -92.367,JAYC,Jay Cooke State Park,SP,218.384.4610,all year, ,80, ,E DP 60ft VT DW SH RS ,MN,2.8,E,Carlton
-91.839,44.173,JOHN/John Latsch State Park  SP PH:507.643.6849 all year COMM:walk to sites only SITES:7  AMEN:NH NR L$ approx 13.1 mi NW of Winona 44.173 -91.839,JOHN,John Latsch State Park,SP,507.643.6849,all year,walk to sites only,7, ,NH NR L$ ,MN,13.1,NW,Winona
-90.082,47.882,JUDG/Judge Magney State Park  SP PH:218.387.3039 all year  SITES:30  AMEN:NH ND SH RS approx 14.8 mi NE of Grand Marais 47.882 -90.082,JUDG,Judge Magney State Park,SP,218.387.3039,all year, ,30, ,NH ND SH RS ,MN,14.8,NE,Grand Marais
-94.98,44.987,KAN1/Kandiyohi County Park 1  CP PH:320.995.6599 mid may-mid oct  SITES:90  AMEN:E DP DW SH approx 5.3 mi W of Lillian 44.987 -94.98,KAN1,Kandiyohi County Park 1,CP,320.995.6599,mid may-mid oct, ,90, ,E DP DW SH ,MN,5.3,W,Lillian
-94.915,45.01,KAN2/Kandiyohi County Park 2  CP PH:320.664.4707 mid may-mid sep  SITES:85  AMEN:E DP DW SH approx 3.7 mi NW of Lillian 45.01 -94.915,KAN2,Kandiyohi County Park 2,CP,320.664.4707,mid may-mid sep, ,85, ,E DP DW SH ,MN,3.7,NW,Lillian
-94.863,45.191,KAN3/Kandiyohi County Park 3  CP PH:320.974.8520 mid may-mid sep  SITES:55  AMEN:E DP DW SH approx 5.3 mi NE of Kandiyohi 45.191 -94.863,KAN3,Kandiyohi County Park 3,CP,320.974.8520,mid may-mid sep, ,55, ,E DP DW SH ,MN,5.3,NE,Kandiyohi
-94.873,45.272,KAN5/Kandiyohi County Park 5  CP PH:320.796.5564 mid may-mid sep  SITES:54  AMEN:E DP DW SH approx 4.3 mi NE of Spicer 45.272 -94.873,KAN5,Kandiyohi County Park 5,CP,320.796.5564,mid may-mid sep, ,54, ,E DP DW SH ,MN,4.3,NE,Spicer
-95.09,45.325,KAN7/Kandiyohi County Park 7  CP PH:320.354.4453 mid may-mid sep  SITES:56  AMEN:E DP DW SH approx 7.3 mi W of New London 45.325 -95.09,KAN7,Kandiyohi County Park 7,CP,320.354.4453,mid may-mid sep, ,56, ,E DP DW SH ,MN,7.3,W,New London
-96.526,48.581,KARL/Karlstad Moose Park  CP PH:218.436.2178  COMM:bad reviews SITES:12  AMEN:WE DP approx 0.4 mi NW of Karlstad 48.581 -96.526,KARL,Karlstad Moose Park,CP,218.436.2178, ,bad reviews,12, ,WE DP ,MN,0.4,NW,Karlstad
-91.103,47.839,KAWI/Kawishiwi Lake  NF PH:218.663.7280/218.626.4300   SITES:5 EL:1659 AMEN:NH ND NS NR approx 35.7 mi E of Ely 47.839 -91.103,KAWI,Kawishiwi Lake,NF,218.663.7280/218.626.4300, , ,5,1659,NH ND NS NR ,MN,35.7,E,Ely
-95.065,43.729,KILE/Kilen Woods State Park  SP PH:507.662.6258 all year  SITES:35  AMEN:E ND DW SH RS approx 6.4 mi NE of Lakefield 43.729 -95.065,KILE,Kilen Woods State Park,SP,507.662.6258,all year, ,35, ,E ND DW SH RS ,MN,6.4,NE,Lakefield
-90.226,47.863,KIMB/Kimball Lake  NF PH:218.387.1750/218.626.4300   SITES:11 EL:1681 AMEN:NH ND NS NR approx 9.2 mi NE of Grand Marais 47.863 -90.226,KIMB,Kimball Lake,NF,218.387.1750/218.626.4300, , ,11,1681,NH ND NS NR ,MN,9.2,NE,Grand Marais
-94.819,46.533,KNOB/Knob Hill  CP   COMM:unknown facilities   AMEN:NH ND NS approx 12.3 mi N  of Staples 46.533 -94.819,KNOB,Knob Hill,CP, , ,unknown facilities, , ,NH ND NS ,MN,12.3,N ,Staples
-94.484,47.45,KNUT/Knutson Dam  NF PH:218.835.3104/218.335.8600 mid may-late aug  SITES:14  AMEN:NH ND VT DW NS RS approx 7.5 mi NE of Cass Lake 47.45 -94.484,KNUT,Knutson Dam,NF,218.835.3104/218.335.8600,mid may-late aug, ,14, ,NH ND VT DW NS RS ,MN,7.5,NE,Cass Lake
-92.076,44.34,KRUG/Kruger - Dorer Memorial Hardwood  SF PH:651.345.3401  COMM:primitive - open all year but snow may block SITES:19  AMEN:NH ND VT DW NS NR L$ approx 2.9 mi SW of Wabasha 44.34 -92.076,KRUG,Kruger - Dorer Memorial Hardwood,SF,651.345.3401, ,primitive - open all year but snow may block,19, ,NH ND VT DW NS NR L$ ,MN,2.9,SW,Wabasha
-95.888,45.02,LACQ/Lac Qui Parle State Park  SP PH:320.752.4736 all year  SITES:40  AMEN:E DP DW SH RS approx 4.3 mi W of Watson 45.02 -95.888,LACQ,Lac Qui Parle State Park,SP,320.752.4736,all year, ,40, ,E DP DW SH RS ,MN,4.3,W,Watson
-95.728,44.951,LAGO/Lagoon Park  CP PH:320.269.6575   SITES:10  AMEN:E DP DW SH N$ approx 0.7 mi N  of Montevideo 44.951 -95.728,LAGO,Lagoon Park,CP,320.269.6575, , ,10, ,E DP DW SH N$ ,MN,0.7,N ,Montevideo
-94.566,44.807,LAKE/Lake Allie Co Park  CP PH:320.523.3768   SITES:22  AMEN:WE DP FT DW approx 5.4 mi NE of Buffalo Lake 44.807 -94.566,LAKE,Lake Allie Co Park,CP,320.523.3768, , ,22, ,WE DP FT DW ,MN,5.4,NE,Buffalo Lake
-94.826,47.539,LAKE/Lake Bemidji State Park  SP PH:218.755.3843 all year  SITES:100  AMEN:E DP DW SH RS approx 5.1 mi NE of Bemidji 47.539 -94.826,LAKE,Lake Bemidji State Park,SP,218.755.3843,all year, ,100, ,E DP DW SH RS ,MN,5.1,NE,Bemidji
-96.626,48.725,LAKR/Lake Bronson State Park  SP PH:218.754.2200 all year  SITES:200  AMEN:E DP DW SH RS approx 1.8 mi SE of Lake Bronson 48.725 -96.626,LAKR,Lake Bronson State Park,SP,218.754.2200,all year, ,200, ,E DP DW SH RS ,MN,1.8,SE,Lake Bronson
-92.949,44.513,LAKB/Lake Byllesby Regional Park  CP PH:507.263.4447   SITES:60  AMEN:WE DP DW SH approx 2.2 mi W of Cannon Falls 44.513 -92.949,LAKB,Lake Byllesby Regional Park,CP,507.263.4447, , ,60, ,WE DP DW SH ,MN,2.2,W,Cannon Falls
-95.336,46,LAKC/Lake Carlos State Park  SP PH:320.852.7200 all year  SITES:125  AMEN:E DP 45ft DW SH RS approx 2.8 mi NW of Carlos 46 -95.336,LAKC,Lake Carlos State Park,SP,320.852.7200,all year, ,125, ,E DP 45ft DW SH RS ,MN,2.8,NW,Carlos
-92.897,44.981,LAEL/Lake Elmo County Park Preserve  CP PH:651.430.8370   SITES:80  AMEN:E DP DW SH approx 1.3 mi SW of Lake Elmo 44.981 -92.897,LAEL,Lake Elmo County Park Preserve,CP,651.430.8370, , ,80, ,E DP DW SH ,MN,1.3,SW,Lake Elmo
-94.55,44.118,LAKH/Lake Hanska County Park  CP PH:507.439.6411   SITES:22  AMEN:E approx 3.5 mi SW of Hanska 44.118 -94.55,LAKH,Lake Hanska County Park,CP,507.439.6411, , ,22, ,E ,MN,3.5,SW,Hanska
-96.434,44.505,LAKP/Lake Hendricks Park  CP PH:507. 275.3192   SITES:27 EL:1758 AMEN:E DP DW SH L$ approx 0.5 mi W of Hendricks 44.505 -96.434,LAKP,Lake Hendricks Park,CP,507. 275.3192, , ,27,1758,E DP DW SH L$ ,MN,0.5,W,Hendricks
-92.297,48.132,LAKJ/Lake Jeanette  NF PH:218.666.0020/218.626.4300   SITES:12  AMEN:NH ND NS RS approx 25.4 mi NW of Ely 48.132 -92.297,LAKJ,Lake Jeanette,NF,218.666.0020/218.626.4300, , ,12, ,NH ND NS RS ,MN,25.4,NW,Ely
-94.728,45.326,LAKK/Lake Koronis Regional Park  CP PH:320.276.8843     AMEN:E DP DW SH approx 3.5 mi S  of Paynesville 45.326 -94.728,LAKK,Lake Koronis Regional Park,CP,320.276.8843, , , , ,E DP DW SH ,MN,3.5,S ,Paynesville
-92.526,43.533,LAKL/Lake Louise State Park  SP PH:507.324.5249 all year  SITES:20  AMEN:E DP DW SH RS approx 3.0 mi SW of LeRoy 43.533 -92.526,LAKL,Lake Louise State Park,SP,507.324.5249,all year, ,20, ,E DP DW SH RS ,MN,3.0,SW,LeRoy
-94.377,44.786,LAKE/Lake Marion Co Park  CP PH:320.328.4479 mid may-mid sep    AMEN:E RS approx 3.8 mi N  of Brownton 44.786 -94.377,LAKE,Lake Marion Co Park,CP,320.328.4479,mid may-mid sep, , , ,E RS ,MN,3.8,N ,Brownton
